question_id,topic,claim_summary,reference_in_question,authoritative_source,status,risk_level,proposed_fix
TX-SAF-0071,SAFE_DRIVING,When should you adjust your mirrors? → Before you start driving,DL-7: Safe Driving Practices,TX DPS DL-7 handbook / TX Transportation Code,PASS,,
TX-SAF-0072,SAFE_DRIVING,What should you do if your windshield wipers are leaving streaks or missing spots? → Replace the wiper blades,DL-7: Safe Driving Practices,TX DPS DL-7 handbook / TX Transportation Code,PASS,,
TX-SAF-0073,SAFE_DRIVING,"How often should tires be rotated? → Every 5,000-7,500 miles",DL-7: Safe Driving Practices,TX DPS DL-7 handbook / TX Transportation Code,PASS,,
TX-SAF-0074,SAFE_DRIVING,Why should you never ignore dashboard warning lights? → They indicate problems that could affect vehicle safety or cause damage,DL-7: Safe Driving Practices,TX DPS DL-7 handbook / TX Transportation Code,PASS,,
TX-SAF-0075,SAFE_DRIVING,"What fluids should be checked regularly in your vehicle? → Engine oil, coolant, brake fluid, power steering fluid, and windshield washer fluid",DL-7: Safe Driving Practices,TX DPS DL-7 handbook / TX Transportation Code,PASS,,
TX-SAF-0076,SAFE_DRIVING,"What can happen if you drive on severely worn tires? → Increased risk of blowouts, hydroplaning, and reduced traction",DL-7: Safe Driving Practices,TX DPS DL-7 handbook / TX Transportation Code,PASS,,
TX-SAF-0077,SAFE_DRIVING,"What should you check on tires besides tread depth? → Pressure, uneven wear patterns, and sidewall damage",DL-7: Safe Driving Practices,TX DPS DL-7 handbook / TX Transportation Code,PASS,,
TX-SAF-0078,SAFE_DRIVING,Why should you keep your windshield clean both inside and out? → To maintain maximum visibility in all conditions,DL-7: Safe Driving Practices,TX DPS DL-7 handbook / TX Transportation Code,PASS,,
TX-SAF-0079,SAFE_DRIVING,What is the main benefit of regular vehicle maintenance? → Prevents breakdowns and ensures all safety systems work properly,DL-7: Safe Driving Practices,TX DPS DL-7 handbook / TX Transportation Code,PASS,,
TX-SAF-0080,SAFE_DRIVING,What is the purpose of checking tire pressure with a gauge rather than visual inspection? → Tires can be significantly under-inflated without looking flat,DL-7: Safe Driving Practices,TX DPS DL-7 handbook / TX Transportation Code,PASS,,
TX-SAF-0081,SAFE_DRIVING,Who must wear seatbelts in Texas? → All vehicle occupants,DL-7: Safe Driving Practices,TX DPS DL-7 handbook / TX Transportation Code,PASS,,
TX-SAF-0082,SAFE_DRIVING,How much do seatbelts reduce the risk of death in a crash? → By about 45%,DL-7: Safe Driving Practices,TX DPS DL-7 handbook / TX Transportation Code,PASS,,
TX-SAF-0083,SAFE_DRIVING,"How should you wear your seatbelt correctly? → Lap belt across hips, shoulder belt across chest and shoulder",DL-7: Safe Driving Practices,TX DPS DL-7 handbook / TX Transportation Code,PASS,,
TX-SAF-0084,SAFE_DRIVING,Until what age or height must children use booster seats in Texas? → Age 8 or 4 feet 9 inches tall,DL-7: Safe Driving Practices,TX DPS DL-7 handbook / TX Transportation Code,PASS,,
TX-SAF-0085,SAFE_DRIVING,Where is the safest place for children under 13 to ride? → In the back seat,DL-7: Safe Driving Practices,TX DPS DL-7 handbook / TX Transportation Code,PASS,,
TX-SAF-0086,SAFE_DRIVING,How far should you sit from the steering wheel to allow for safe airbag deployment? → At least 10 inches,DL-7: Safe Driving Practices,TX DPS DL-7 handbook / TX Transportation Code,PASS,,
TX-SAF-0087,SAFE_DRIVING,"Do airbags replace the need for seatbelts? → No, airbags are designed to work with seatbelts, not replace them",DL-7: Safe Driving Practices,TX DPS DL-7 handbook / TX Transportation Code,PASS,,
TX-SAF-0088,SAFE_DRIVING,"How should pregnant women wear seatbelts? → Lap belt below the belly, shoulder belt between breasts",DL-7: Safe Driving Practices,TX DPS DL-7 handbook / TX Transportation Code,PASS,,
TX-SAF-0089,SAFE_DRIVING,When should rear-facing child safety seats be turned to face forward? → After age 2 or when child exceeds seat's height/weight limits,DL-7: Safe Driving Practices,TX DPS DL-7 handbook / TX Transportation Code,PASS,,
TX-SAF-0090,SAFE_DRIVING,Why should you never place a rear-facing child seat in front of an active airbag? → Airbag deployment can cause severe injury or death to the child,DL-7: Safe Driving Practices,TX DPS DL-7 handbook / TX Transportation Code,PASS,,
TX-SIG-0001,SIGNS,What shape is a STOP sign? → Octagon (8 sides),DL-7: Traffic Signs,TX DPS DL-7 handbook / TX Transportation Code,PASS,,
TX-SIG-0002,SIGNS,What does a YIELD sign indicate? → Slow down and give right-of-way to other traffic,DL-7: Traffic Signs,TX DPS DL-7 handbook / TX Transportation Code,PASS,,
TX-SIG-0003,SIGNS,What is the shape of a YIELD sign? → Downward-pointing triangle,DL-7: Traffic Signs,TX DPS DL-7 handbook / TX Transportation Code,PASS,,
TX-SIG-0004,SIGNS,What does this speed limit sign indicate? → The maximum legal speed is 65 mph,DL-7: Traffic Signs,TX DPS DL-7 handbook / TX Transportation Code,PASS,,
TX-SIG-0005,SIGNS,What must you do when you see a DO NOT ENTER sign? → Do not proceed in that direction,DL-7: Traffic Signs,TX DPS DL-7 handbook / TX Transportation Code,PASS,,
TX-SIG-0006,SIGNS,"If you see a WRONG WAY sign, you should: → Immediately pull over safely and turn around",DL-7: Traffic Signs,TX DPS DL-7 handbook / TX Transportation Code,PASS,,
TX-SIG-0007,SIGNS,What does a NO LEFT TURN sign prohibit? → Making a left turn at that location,DL-7: Traffic Signs,TX DPS DL-7 handbook / TX Transportation Code,PASS,,
TX-SIG-0008,SIGNS,"When you see a NO RIGHT TURN sign at an intersection, you must: → Not turn right at that location",DL-7: Traffic Signs,TX DPS DL-7 handbook / TX Transportation Code,PASS,,
TX-SIG-0009,SIGNS,What does a NO U-TURN sign indicate? → U-turns are prohibited at this location,DL-7: Traffic Signs,TX DPS DL-7 handbook / TX Transportation Code,PASS,,
TX-SIG-0010,SIGNS,What does a NO PARKING ANYTIME sign mean? → Parking is never permitted at this location,DL-7: Traffic Signs,TX DPS DL-7 handbook / TX Transportation Code,PASS,,
TX-SIG-0011,SIGNS,"When you see a ONE WAY sign, you must: → Travel only in the direction indicated",DL-7: Traffic Signs,TX DPS DL-7 handbook / TX Transportation Code,PASS,,
TX-SIG-0012,SIGNS,What does a DO NOT PASS sign indicate? → Passing is prohibited in this zone,DL-7: Traffic Signs,TX DPS DL-7 handbook / TX Transportation Code,PASS,,
TX-SIG-0013,SIGNS,What does this sign indicate about railroad crossings? → A railroad crossing is ahead,DL-7: Traffic Signs,TX DPS DL-7 handbook / TX Transportation Code,PASS,,
TX-SIG-0014,SIGNS,What does a NO TRUCKS sign typically prohibit? → Commercial vehicles above a certain weight,DL-7: Traffic Signs,TX DPS DL-7 handbook / TX Transportation Code,PASS,,
TX-SIG-0015,SIGNS,What does a KEEP RIGHT sign require you to do? → Stay to the right of an obstruction or divider,DL-7: Traffic Signs,TX DPS DL-7 handbook / TX Transportation Code,PASS,,
TX-SIG-0016,SIGNS,What does a LEFT TURN ONLY sign indicate? → Vehicles in this lane must turn left,DL-7: Traffic Signs,TX DPS DL-7 handbook / TX Transportation Code,PASS,,
TX-SIG-0017,SIGNS,"If you are in a lane marked with a RIGHT TURN ONLY sign, you must: → Turn right from that lane",DL-7: Traffic Signs,TX DPS DL-7 handbook / TX Transportation Code,PASS,,
TX-SIG-0018,SIGNS,What is the penalty for parking in a space marked with a HANDICAPPED PARKING sign without proper authorization? → Substantial fine and possible towing,DL-7: Traffic Signs,TX DPS DL-7 handbook / TX Transportation Code,PASS,,
TX-SIG-0019,SIGNS,"At a STOP sign, you must stop: → Before the stop line, crosswalk, or intersection",DL-7: Traffic Signs,TX DPS DL-7 handbook / TX Transportation Code,PASS,,
TX-SIG-0020,SIGNS,What color are most regulatory signs? → White background with black or red symbols,DL-7: Traffic Signs,TX DPS DL-7 handbook / TX Transportation Code,PASS,,
TX-SIG-0021,SIGNS,"If a speed limit sign shows 70 mph, but weather conditions are poor, you should: → Drive slower than the posted limit based on conditions",DL-7: Traffic Signs,TX DPS DL-7 handbook / TX Transportation Code,PASS,,
TX-SIG-0022,SIGNS,What is the typical speed limit in school zones when children are present? → 20 mph,DL-7: Traffic Signs,TX DPS DL-7 handbook / TX Transportation Code,PASS,,
TX-SIG-0023,SIGNS,A red circle with a red slash over a black symbol on a white background indicates: → A prohibited action,DL-7: Traffic Signs,TX DPS DL-7 handbook / TX Transportation Code,PASS,,
TX-SIG-0024,SIGNS,What is the minimum speed you should drive on a road with a 65 mph speed limit in Texas? → There is no minimum unless posted separately,DL-7: Traffic Signs,TX DPS DL-7 handbook / TX Transportation Code,PASS,,
TX-SIG-0025,SIGNS,"Where are you most likely to see a NO PARKING sign? → Near fire hydrants, intersections, or driveways",DL-7: Traffic Signs,TX DPS DL-7 handbook / TX Transportation Code,PASS,,
TX-SIG-0026,SIGNS,Which sign would you expect to see at the entrance ramp to a highway going the wrong direction? → Both DO NOT ENTER and WRONG WAY signs,DL-7: Traffic Signs,TX DPS DL-7 handbook / TX Transportation Code,PASS,,
TX-SIG-0027,SIGNS,A residential street with a speed limit of 30 mph means: → 30 mph is the maximum legal speed,DL-7: Traffic Signs,TX DPS DL-7 handbook / TX Transportation Code,PASS,,
TX-SIG-0028,SIGNS,"If you encounter both a YIELD sign and a stopped school bus with flashing red lights, which takes priority? → The school bus - you must stop",DL-7: Traffic Signs,TX DPS DL-7 handbook / TX Transportation Code,PASS,,
TX-SIG-0029,SIGNS,"At an intersection with a STOP sign and a malfunctioning traffic signal, how should you proceed? → Treat it as a four-way stop if multiple approaches have signals",DL-7: Traffic Signs,TX DPS DL-7 handbook / TX Transportation Code,PASS,,
TX-SIG-0030,SIGNS,What does it mean if a NO PARKING sign has an arrow pointing right? → No parking from the sign onward in that direction,DL-7: Traffic Signs,TX DPS DL-7 handbook / TX Transportation Code,PASS,,
TX-SIG-0031,SIGNS,"At a railroad crossing with both signals and a STOP sign, when must you stop? → When signals are flashing or a train is approaching",DL-7: Traffic Signs,TX DPS DL-7 handbook / TX Transportation Code,PASS,,
TX-SIG-0032,SIGNS,What does a diamond-shaped sign typically indicate? → A warning of road conditions ahead,DL-7: Traffic Signs,TX DPS DL-7 handbook / TX Transportation Code,PASS,,
TX-SIG-0033,SIGNS,What does a CURVE RIGHT warning sign indicate? → The road curves to the right ahead,DL-7: Traffic Signs,TX DPS DL-7 handbook / TX Transportation Code,PASS,,
TX-SIG-0034,SIGNS,"When you see a CURVE LEFT sign, you should: → Slow down before entering the curve",DL-7: Traffic Signs,TX DPS DL-7 handbook / TX Transportation Code,PASS,,
TX-SIG-0035,SIGNS,What does a WINDING ROAD sign warn you about? → A series of curves ahead,DL-7: Traffic Signs,TX DPS DL-7 handbook / TX Transportation Code,PASS,,
TX-SIG-0036,SIGNS,What does a SIDE ROAD warning sign indicate? → Another road intersects from the side,DL-7: Traffic Signs,TX DPS DL-7 handbook / TX Transportation Code,PASS,,
TX-SIG-0037,SIGNS,What type of intersection does a Y-INTERSECTION warning sign indicate? → The road splits into two roads ahead,DL-7: Traffic Signs,TX DPS DL-7 handbook / TX Transportation Code,PASS,,
TX-SIG-0038,SIGNS,A T-INTERSECTION warning sign means: → The road ends ahead at a cross street,DL-7: Traffic Signs,TX DPS DL-7 handbook / TX Transportation Code,PASS,,
TX-SIG-0039,SIGNS,What does a MERGE warning sign indicate? → Traffic from another road is entering your lane,DL-7: Traffic Signs,TX DPS DL-7 handbook / TX Transportation Code,PASS,,
TX-SIG-0040,SIGNS,A LANE ENDS MERGE sign indicates: → Your lane will end and you must merge into the adjacent lane,DL-7: Traffic Signs,TX DPS DL-7 handbook / TX Transportation Code,PASS,,
TX-SIG-0041,SIGNS,What does a HILL warning sign indicate? → A steep grade or hill is ahead,DL-7: Traffic Signs,TX DPS DL-7 handbook / TX Transportation Code,PASS,,
TX-SIG-0042,SIGNS,What does a PEDESTRIAN CROSSING warning sign mean? → Watch for pedestrians crossing the road,DL-7: Traffic Signs,TX DPS DL-7 handbook / TX Transportation Code,PASS,,
TX-SIG-0043,SIGNS,A BICYCLE CROSSING warning sign indicates: → Watch for bicycles crossing the roadway,DL-7: Traffic Signs,TX DPS DL-7 handbook / TX Transportation Code,PASS,,
TX-SIG-0044,SIGNS,What does a TRUCK CROSSING warning sign indicate? → Large trucks frequently cross or enter the roadway,DL-7: Traffic Signs,TX DPS DL-7 handbook / TX Transportation Code,PASS,,
TX-SIG-0045,SIGNS,A FARM EQUIPMENT warning sign is most likely to be found: → In rural areas where slow-moving farm vehicles use the road,DL-7: Traffic Signs,TX DPS DL-7 handbook / TX Transportation Code,PASS,,
TX-SIG-0046,SIGNS,What does a SCHOOL CROSSING warning sign indicate? → Children may be crossing the road near a school,DL-7: Traffic Signs,TX DPS DL-7 handbook / TX Transportation Code,PASS,,
TX-SIG-0047,SIGNS,What does a SLIPPERY WHEN WET warning sign mean? → The road surface becomes slippery in wet conditions,DL-7: Traffic Signs,TX DPS DL-7 handbook / TX Transportation Code,PASS,,
TX-SIG-0048,SIGNS,What does a ROAD CONSTRUCTION warning sign indicate? → Workers and equipment may be on or near the roadway,DL-7: Traffic Signs,TX DPS DL-7 handbook / TX Transportation Code,PASS,,
TX-SIG-0049,SIGNS,A FLAGGER AHEAD sign warns that: → A person will be directing traffic ahead,DL-7: Traffic Signs,TX DPS DL-7 handbook / TX Transportation Code,PASS,,
TX-SIG-0050,SIGNS,What color are warning signs typically? → Yellow or orange with black symbols,DL-7: Traffic Signs,TX DPS DL-7 handbook / TX Transportation Code,PASS,,
TX-SIG-0051,SIGNS,When you see a curve warning sign with an advisory speed plaque showing 35 mph: → 35 mph is the recommended safe speed for that curve,DL-7: Traffic Signs,TX DPS DL-7 handbook / TX Transportation Code,PASS,,
TX-SIG-0052,SIGNS,A chevron sign in a curve indicates: → The direction and sharpness of the curve,DL-7: Traffic Signs,TX DPS DL-7 handbook / TX Transportation Code,PASS,,
TX-SIG-0053,SIGNS,"If you see multiple CURVE warning signs in succession, this indicates: → Several curves following one another",DL-7: Traffic Signs,TX DPS DL-7 handbook / TX Transportation Code,PASS,,
TX-SIG-0054,SIGNS,"At a T-intersection, if there is no warning sign, who typically has the right-of-way? → Traffic on the through road (cross street)",DL-7: Traffic Signs,TX DPS DL-7 handbook / TX Transportation Code,PASS,,
TX-SIG-0055,SIGNS,A MERGE sign is different from a YIELD sign because: → MERGE warns of entering traffic; YIELD requires you to give way,DL-7: Traffic Signs,TX DPS DL-7 handbook / TX Transportation Code,PASS,,
TX-SIG-0056,SIGNS,"When a PEDESTRIAN CROSSING sign is accompanied by a school crossing symbol, what does this indicate? → School children cross at this location",DL-7: Traffic Signs,TX DPS DL-7 handbook / TX Transportation Code,PASS,,
TX-SIG-0057,SIGNS,"In a work zone with both a posted speed limit and a ROAD CONSTRUCTION sign, which speed should you follow? → The posted work zone speed limit",DL-7: Traffic Signs,TX DPS DL-7 handbook / TX Transportation Code,PASS,,
TX-SIG-0058,SIGNS,A warning sign with a downward-pointing arrow symbol typically indicates: → Steep downgrade ahead,DL-7: Traffic Signs,TX DPS DL-7 handbook / TX Transportation Code,PASS,,
TX-SIG-0059,SIGNS,Why are curve warning signs important in rural areas? → Higher speeds make curves more dangerous,DL-7: Traffic Signs,TX DPS DL-7 handbook / TX Transportation Code,PASS,,
TX-SIG-0060,SIGNS,"If a LANE ENDS MERGE sign shows the right lane ending, and both lanes are full, who should yield? → Traffic in the ending lane should yield",DL-7: Traffic Signs,TX DPS DL-7 handbook / TX Transportation Code,PASS,,
TX-SIG-0061,SIGNS,"What does an Interstate highway sign look like? → Red, white, and blue shield shape",DL-7: Traffic Signs,TX DPS DL-7 handbook / TX Transportation Code,PASS,,
TX-SIG-0062,SIGNS,What does Interstate 10 signage indicate? → You are on a major cross-country highway,DL-7: Traffic Signs,TX DPS DL-7 handbook / TX Transportation Code,PASS,,
TX-SIG-0063,SIGNS,What shape is a US Route highway sign? → White shield with black numbers,DL-7: Traffic Signs,TX DPS DL-7 handbook / TX Transportation Code,PASS,,
TX-SIG-0064,SIGNS,What does a State Route marker indicate in Texas? → A state-maintained highway route,DL-7: Traffic Signs,TX DPS DL-7 handbook / TX Transportation Code,PASS,,
TX-SIG-0065,SIGNS,What does an EXIT sign on a highway indicate? → An upcoming exit ramp to leave the highway,DL-7: Traffic Signs,TX DPS DL-7 handbook / TX Transportation Code,PASS,,
TX-SIG-0066,SIGNS,What information does a DISTANCE sign typically provide? → Miles to upcoming cities or destinations,DL-7: Traffic Signs,TX DPS DL-7 handbook / TX Transportation Code,PASS,,
TX-SIG-0067,SIGNS,What does a REST AREA sign indicate? → A facility with parking and restrooms is ahead,DL-7: Traffic Signs,TX DPS DL-7 handbook / TX Transportation Code,PASS,,
TX-SIG-0068,SIGNS,What does a HOSPITAL sign indicate? → Medical facility location and direction,DL-7: Traffic Signs,TX DPS DL-7 handbook / TX Transportation Code,PASS,,
TX-SIG-0069,SIGNS,What does a GAS STATION service sign indicate? → Fuel services available at next exit or ahead,DL-7: Traffic Signs,TX DPS DL-7 handbook / TX Transportation Code,PASS,,
TX-SIG-0070,SIGNS,What color are most guide and information signs? → Green with white lettering,DL-7: Traffic Signs,TX DPS DL-7 handbook / TX Transportation Code,PASS,,
TX-SIG-0071,SIGNS,What is the difference between even and odd Interstate numbers? → Even numbers run east-west; odd numbers run north-south,DL-7: Traffic Signs,TX DPS DL-7 handbook / TX Transportation Code,PASS,,
TX-SIG-0072,SIGNS,"Blue service signs typically indicate: → Food, gas, lodging, and other services",DL-7: Traffic Signs,TX DPS DL-7 handbook / TX Transportation Code,PASS,,
TX-SIG-0073,SIGNS,"What do brown signs typically indicate? → Parks, recreational areas, and points of interest",DL-7: Traffic Signs,TX DPS DL-7 handbook / TX Transportation Code,PASS,,
TX-SIG-0074,SIGNS,Mile marker signs help drivers by: → Providing location reference for navigation and emergencies,DL-7: Traffic Signs,TX DPS DL-7 handbook / TX Transportation Code,PASS,,
TX-SIG-0075,SIGNS,An EXIT ONLY lane sign means: → This lane must exit and cannot continue on the highway,DL-7: Traffic Signs,TX DPS DL-7 handbook / TX Transportation Code,PASS,,
TX-SIG-0076,SIGNS,A three-digit Interstate number starting with an even digit (like I-210) typically indicates: → A loop or beltway around a city,DL-7: Traffic Signs,TX DPS DL-7 handbook / TX Transportation Code,PASS,,
TX-SIG-0077,SIGNS,A three-digit Interstate number starting with an odd digit (like I-335) typically indicates: → A spur route connecting to a city,DL-7: Traffic Signs,TX DPS DL-7 handbook / TX Transportation Code,PASS,,
TX-SIG-0078,SIGNS,What should you do when you see a REST AREA sign and you feel drowsy? → Exit and take a break to rest before continuing,DL-7: Traffic Signs,TX DPS DL-7 handbook / TX Transportation Code,PASS,,
TX-SIG-0079,SIGNS,"When following Interstate 35 through Texas, you are traveling: → Generally north-south through central Texas",DL-7: Traffic Signs,TX DPS DL-7 handbook / TX Transportation Code,PASS,,
TX-SIG-0080,SIGNS,"If you miss your intended highway exit, you should: → Continue to the next exit and backtrack safely",DL-7: Traffic Signs,TX DPS DL-7 handbook / TX Transportation Code,PASS,,
TX-SIG-0081,SIGNS,What does a KEEP RIGHT sign in the center of a roadway indicate? → Traffic must pass to the right of an island or obstruction,DL-7: Traffic Signs,TX DPS DL-7 handbook / TX Transportation Code,PASS,,
TX-SIG-0082,SIGNS,A KEEP LEFT sign would typically appear: → On an island or median to direct traffic left,DL-7: Traffic Signs,TX DPS DL-7 handbook / TX Transportation Code,PASS,,
TX-SIG-0083,SIGNS,"When approaching a curve with both a warning sign and chevron markers, you should: → Follow the chevron arrows while maintaining safe speed",DL-7: Traffic Signs,TX DPS DL-7 handbook / TX Transportation Code,PASS,,
TX-SIG-0084,SIGNS,"If regulatory and warning signs give conflicting information, which should you follow? → Regulatory signs, as they indicate legal requirements",DL-7: Traffic Signs,TX DPS DL-7 handbook / TX Transportation Code,PASS,,
TX-SIG-0085,SIGNS,A sign showing a truck on a downgrade typically warns: → Steep hill where trucks may have brake problems,DL-7: Traffic Signs,TX DPS DL-7 handbook / TX Transportation Code,PASS,,
TX-SIG-0086,SIGNS,"When warning signs are placed on both sides of the road, this typically indicates: → The hazard affects both directions of travel",DL-7: Traffic Signs,TX DPS DL-7 handbook / TX Transportation Code,PASS,,
TX-SIG-0087,SIGNS,A pennant-shaped sign indicates: → No passing zone begins,DL-7: Traffic Signs,TX DPS DL-7 handbook / TX Transportation Code,PASS,,
TX-SIG-0088,SIGNS,"If you see a STOP sign with a white border versus one without, what is the difference? → No functional difference; both require a complete stop",DL-7: Traffic Signs,TX DPS DL-7 handbook / TX Transportation Code,PASS,,
TX-SIG-0089,SIGNS,What does a sign with a circular red symbol typically indicate? → A prohibition or restriction,DL-7: Traffic Signs,TX DPS DL-7 handbook / TX Transportation Code,PASS,,
TX-SIG-0090,SIGNS,"At night, sign colors appear differently. Which sign color is most visible at night? → All are equally visible due to reflective materials",DL-7: Traffic Signs,TX DPS DL-7 handbook / TX Transportation Code,PASS,,
TX-SIG-0091,SIGNS,Why are STOP signs red? → Red is the most attention-getting color indicating danger,DL-7: Traffic Signs,TX DPS DL-7 handbook / TX Transportation Code,PASS,,
TX-SIG-0092,SIGNS,A damaged or faded sign that is unreadable means: → Exercise extra caution and follow general traffic rules,DL-7: Traffic Signs,TX DPS DL-7 handbook / TX Transportation Code,PASS,,
TX-SIG-0093,SIGNS,"When two different speed limit signs are visible with different numbers, which applies? → The lower speed limit closest to you",DL-7: Traffic Signs,TX DPS DL-7 handbook / TX Transportation Code,PASS,,
TX-SIG-0094,SIGNS,Why are some warning signs larger than others? → Larger signs are used where higher speeds require more advance warning,DL-7: Traffic Signs,TX DPS DL-7 handbook / TX Transportation Code,PASS,,
TX-SIG-0095,SIGNS,What should you do if a traffic light and a STOP sign are both present at an intersection? → Obey the traffic light when functioning; treat as stop when not,DL-7: Traffic Signs,TX DPS DL-7 handbook / TX Transportation Code,PASS,,
TX-SIG-0096,SIGNS,Work zone signs are typically what color? → Orange with black symbols,DL-7: Traffic Signs,TX DPS DL-7 handbook / TX Transportation Code,PASS,,
TX-SIG-0097,SIGNS,"At an intersection with a YIELD sign and a vehicle approaching from your right, you should: → Yield to the vehicle on your right",DL-7: Traffic Signs,TX DPS DL-7 handbook / TX Transportation Code,PASS,,
TX-SIG-0098,SIGNS,A sign reading 'ROAD CLOSED' means: → Do not enter; the road is impassable or dangerous,DL-7: Traffic Signs,TX DPS DL-7 handbook / TX Transportation Code,PASS,,
TX-SIG-0099,SIGNS,What does 'REDUCED SPEED AHEAD' mean? → The speed limit will decrease soon,DL-7: Traffic Signs,TX DPS DL-7 handbook / TX Transportation Code,PASS,,
TX-SIG-0100,SIGNS,A 'DETOUR' sign indicates: → Follow alternate route due to road closure,DL-7: Traffic Signs,TX DPS DL-7 handbook / TX Transportation Code,PASS,,
TX-SIG-0101,SIGNS,What does a 'CROSS TRAFFIC DOES NOT STOP' sign mean? → You have a stop sign but cross traffic does not,DL-7: Traffic Signs,TX DPS DL-7 handbook / TX Transportation Code,PASS,,
TX-SIG-0102,SIGNS,A black and white circular sign with 'RR' and an 'X' indicates: → Railroad crossing ahead,DL-7: Traffic Signs,TX DPS DL-7 handbook / TX Transportation Code,PASS,,
TX-SIG-0103,SIGNS,"If you encounter a sign you do not recognize or understand, you should: → Proceed with caution and research the sign later",DL-7: Traffic Signs,TX DPS DL-7 handbook / TX Transportation Code,PASS,,
TX-SIG-0104,SIGNS,Why do some areas have multiple speed limit signs close together? → To ensure visibility after passing points and for emphasis,DL-7: Traffic Signs,TX DPS DL-7 handbook / TX Transportation Code,PASS,,
TX-SIG-0105,SIGNS,A sign showing two arrows pointing in opposite directions indicates: → Two-way traffic or divided highway ends,DL-7: Traffic Signs,TX DPS DL-7 handbook / TX Transportation Code,PASS,,
TX-SIG-0106,SIGNS,What does an 'EMERGENCY PARKING ONLY' sign mean? → Park here only for vehicle emergencies,DL-7: Traffic Signs,TX DPS DL-7 handbook / TX Transportation Code,PASS,,
TX-SIG-0107,SIGNS,A 'BRIDGE ICES BEFORE ROAD' sign warns that: → Bridge surfaces freeze before regular roadway in cold weather,DL-7: Traffic Signs,TX DPS DL-7 handbook / TX Transportation Code,PASS,,
TX-SIG-0108,SIGNS,What is the purpose of a 'PHOTO ENFORCED' sign below a traffic signal? → Cameras monitor and ticket traffic violations,DL-7: Traffic Signs,TX DPS DL-7 handbook / TX Transportation Code,PASS,,
TX-SIG-0109,SIGNS,"If a speed limit sign has the words 'NIGHT' or 'NIGHTTIME' on it, this means: → A different speed limit applies during nighttime hours",DL-7: Traffic Signs,TX DPS DL-7 handbook / TX Transportation Code,PASS,,
