question_id,topic,claim_summary,reference_in_question,authoritative_source,status,risk_level,proposed_fix
TX-ROW-0084,RIGHT_OF_WAY,You are on a highway and need to exit. Another vehicle is in your blind spot. Who has the right-of-way? → The vehicle in your blind spot,DL-7: Right-of-Way Rules,TX DPS DL-7 handbook / TX Transportation Code,PASS,,
TX-ROW-0085,RIGHT_OF_WAY,Two vehicles are merging onto a highway from separate entrance ramps at the same point. Who has the right-of-way? → The vehicle that is ahead or on the right,DL-7: Right-of-Way Rules,TX DPS DL-7 handbook / TX Transportation Code,PASS,,
TX-ROW-0086,RIGHT_OF_WAY,You are passing a slower vehicle on a two-lane highway. An oncoming vehicle appears. Who has the right-of-way? → The oncoming vehicle in its own lane,DL-7: Right-of-Way Rules,TX DPS DL-7 handbook / TX Transportation Code,PASS,,
TX-ROW-0087,RIGHT_OF_WAY,You are entering a highway from a parking lot or driveway. Who has the right-of-way? → All vehicles already on the highway,DL-7: Right-of-Way Rules,TX DPS DL-7 handbook / TX Transportation Code,PASS,,
TX-ROW-0088,RIGHT_OF_WAY,You see a merge warning sign on the highway. What does this indicate? → Traffic from another roadway will be merging ahead; be prepared to adjust,DL-7: Right-of-Way Rules,TX DPS DL-7 handbook / TX Transportation Code,PASS,,
TX-ROW-0089,RIGHT_OF_WAY,You are driving on a highway and your lane is ending (forced merge). Who has the right-of-way? → Vehicles in the continuing lane,DL-7: Right-of-Way Rules,TX DPS DL-7 handbook / TX Transportation Code,PASS,,
TX-ROW-0090,RIGHT_OF_WAY,You are on a highway entrance ramp with a yield sign. When can you merge? → Only when there is a safe gap in highway traffic,DL-7: Right-of-Way Rules,TX DPS DL-7 handbook / TX Transportation Code,PASS,,
TX-ROW-0091,RIGHT_OF_WAY,"You are on a three-lane highway. You are in the center lane. Vehicles are merging from the right, and a vehicle on your left is signaling to move into your lane. Who has the right-of-way? → You have t",DL-7: Right-of-Way Rules,TX DPS DL-7 handbook / TX Transportation Code,PASS,,
TX-ROW-0092,RIGHT_OF_WAY,You are exiting a highway and need to cross lanes of traffic. Who has the right-of-way? → Vehicles in the lanes you need to cross,DL-7: Right-of-Way Rules,TX DPS DL-7 handbook / TX Transportation Code,PASS,,
TX-ROW-0093,RIGHT_OF_WAY,"On a two-lane road, you are behind a slow-moving vehicle and want to pass. There is a dashed yellow line. What should you do? → Check for oncoming traffic, and pass only if you can complete it safely ",DL-7: Right-of-Way Rules,TX DPS DL-7 handbook / TX Transportation Code,PASS,,
TX-ROW-0094,RIGHT_OF_WAY,"You are on a highway acceleration lane (entrance ramp). The lane is about to end and you need to merge, but there is steady traffic and no gaps. What should you do? → Adjust your speed to create a gap",DL-7: Right-of-Way Rules,TX DPS DL-7 handbook / TX Transportation Code,PASS,,
TX-ROW-0095,RIGHT_OF_WAY,You see a lane ends sign. What should you do? → Merge into the continuing lane when it is safe to do so,DL-7: Right-of-Way Rules,TX DPS DL-7 handbook / TX Transportation Code,PASS,,
TX-ROW-0096,RIGHT_OF_WAY,You are passing a vehicle on a two-lane road. Oncoming traffic suddenly appears closer than expected. What should you do? → Abort the pass and return to your lane immediately,DL-7: Right-of-Way Rules,TX DPS DL-7 handbook / TX Transportation Code,PASS,,
TX-ROW-0097,RIGHT_OF_WAY,You are on a highway and traffic ahead is slowing down for a vehicle entering from an entrance ramp. What should you do? → Slow down with traffic and maintain safe following distance,DL-7: Right-of-Way Rules,TX DPS DL-7 handbook / TX Transportation Code,PASS,,
TX-ROW-0098,RIGHT_OF_WAY,You are on a two-lane highway passing a slow vehicle. Another faster vehicle behind you is tailgating. Who has the right-of-way? → You have the right-of-way to complete your pass safely before returni,DL-7: Right-of-Way Rules,TX DPS DL-7 handbook / TX Transportation Code,PASS,,
TX-ROW-0099,RIGHT_OF_WAY,You are preparing to merge onto a highway. Should you stop on the entrance ramp? → Only if absolutely necessary; use the ramp to accelerate and merge smoothly,DL-7: Right-of-Way Rules,TX DPS DL-7 handbook / TX Transportation Code,PASS,,
TX-ROW-0100,RIGHT_OF_WAY,"You are on a highway in heavy traffic. Your exit is coming up, but you are in the left lane and there is no gap to move right. What should you do? → Miss your exit and take the next one",DL-7: Right-of-Way Rules,TX DPS DL-7 handbook / TX Transportation Code,PASS,,
TX-ROW-0101,RIGHT_OF_WAY,"At a 4-way stop, you arrive at the same time as another vehicle to your left. You are both turning right onto the same road. Who has the right-of-way? → You have the right-of-way since you are on the ",DL-7: Right-of-Way Rules,TX DPS DL-7 handbook / TX Transportation Code,PASS,,
TX-ROW-0102,RIGHT_OF_WAY,You are turning left from a minor road onto a major highway. Traffic on the highway is heavy in both directions. When can you proceed? → Only when there is a sufficient gap in both directions to compl,DL-7: Right-of-Way Rules,TX DPS DL-7 handbook / TX Transportation Code,PASS,,
TX-ROW-0103,RIGHT_OF_WAY,"You are at an intersection waiting to turn left. Your light turns yellow, then red, but you are already in the intersection. What should you do? → Complete your turn when oncoming traffic stops",DL-7: Right-of-Way Rules,TX DPS DL-7 handbook / TX Transportation Code,PASS,,
TX-ROW-0104,RIGHT_OF_WAY,"At an intersection with a four-way flashing red light, how should you proceed? → Treat each direction as a stop sign and proceed in order of arrival",DL-7: Right-of-Way Rules,TX DPS DL-7 handbook / TX Transportation Code,PASS,,
TX-ROW-0105,RIGHT_OF_WAY,You are in a roundabout. An emergency vehicle with lights and sirens is trying to enter. What should you do? → Exit the roundabout at the next available exit and pull over,DL-7: Right-of-Way Rules,TX DPS DL-7 handbook / TX Transportation Code,PASS,,
TX-ROW-0106,RIGHT_OF_WAY,"At a T-intersection, you are on the through road. A vehicle on the terminating road has a stop sign. You want to turn left onto the terminating road. Who proceeds first? → You proceed first as you are",DL-7: Right-of-Way Rules,TX DPS DL-7 handbook / TX Transportation Code,PASS,,
TX-ROW-0107,RIGHT_OF_WAY,"You are merging onto a highway. The vehicle behind you on the highway is tailgating the car in front of it. Should you merge into that gap? → No, find a safer gap with adequate following distance",DL-7: Right-of-Way Rules,TX DPS DL-7 handbook / TX Transportation Code,PASS,,
TX-ROW-0108,RIGHT_OF_WAY,"You are at a complex intersection. You have a green left turn arrow. A pedestrian with a guide dog is crossing the street you want to turn onto, but their signal shows 'Don't Walk'. An oncoming car ru",DL-7: Right-of-Way Rules,TX DPS DL-7 handbook / TX Transportation Code,PASS,,
TX-ROW-0109,RIGHT_OF_WAY,"You are driving on a highway in the left lane. You see a slower vehicle ahead in your lane. Do you have the right to stay in the left lane? → No, the left lane is for passing; move right after passing",DL-7: Right-of-Way Rules,TX DPS DL-7 handbook / TX Transportation Code,PASS,,
TX-ROW-0110,RIGHT_OF_WAY,"You are on a two-lane road following a mail carrier who stops frequently. Can you pass? → Yes, if it is safe and legal to pass",DL-7: Right-of-Way Rules,TX DPS DL-7 handbook / TX Transportation Code,PASS,,
TX-ROW-0111,RIGHT_OF_WAY,"At an uncontrolled intersection, you are turning left and another vehicle is approaching from the right going straight. Who has the right-of-way? → The vehicle on the right going straight has right-of",DL-7: Right-of-Way Rules,TX DPS DL-7 handbook / TX Transportation Code,PASS,,
TX-ROW-0112,RIGHT_OF_WAY,You are exiting a parking garage onto a busy street. A pedestrian is walking on the sidewalk approaching your exit. Who has the right-of-way? → The pedestrian on the sidewalk,DL-7: Right-of-Way Rules,TX DPS DL-7 handbook / TX Transportation Code,PASS,,
TX-ROW-0113,RIGHT_OF_WAY,You approach a railway crossing with flashing lights. The gates are not down yet. What should you do? → Stop and do not proceed until the lights stop flashing,DL-7: Right-of-Way Rules,TX DPS DL-7 handbook / TX Transportation Code,PASS,,
TX-ROW-0114,RIGHT_OF_WAY,"At an intersection with a traffic light, you want to go straight and have a green light. Do you need to yield to any traffic? → Yes, yield to pedestrians in the crosswalk and vehicles already in the i",DL-7: Right-of-Way Rules,TX DPS DL-7 handbook / TX Transportation Code,PASS,,
TX-ROW-0115,RIGHT_OF_WAY,"You are on a highway that is ending (merging into another highway). Does traffic on the continuing highway need to yield to you? → No, you must yield to traffic on the continuing highway",DL-7: Right-of-Way Rules,TX DPS DL-7 handbook / TX Transportation Code,PASS,,
TX-ROW-0116,RIGHT_OF_WAY,"At a 4-way stop, you arrive first. As you begin to proceed, another vehicle runs the stop sign from your right. What should you do? → Stop or slow down to avoid a collision, even though you have the r",DL-7: Right-of-Way Rules,TX DPS DL-7 handbook / TX Transportation Code,PASS,,
TX-ROW-0117,RIGHT_OF_WAY,"You see a one-way sign. A vehicle is driving the wrong way toward you. Who has the right-of-way? → You do, but avoid the collision by pulling to the right if possible",DL-7: Right-of-Way Rules,TX DPS DL-7 handbook / TX Transportation Code,PASS,,
TX-ROW-0118,RIGHT_OF_WAY,You are in the intersection waiting to turn left. The light is green. Oncoming traffic is heavy but stops for a pedestrian in the crosswalk. The light turns yellow. What should you do? → Wait for the ,DL-7: Right-of-Way Rules,TX DPS DL-7 handbook / TX Transportation Code,PASS,,
TX-ROW-0119,RIGHT_OF_WAY,"Two vehicles approach an uncontrolled intersection from perpendicular directions. Vehicle A is on a wider road, Vehicle B is on a narrow road. Who has the right-of-way? → The vehicle on the right, reg",DL-7: Right-of-Way Rules,TX DPS DL-7 handbook / TX Transportation Code,PASS,,
TX-ROW-0120,RIGHT_OF_WAY,You are turning right at a red light (where permitted). A vehicle to your left is turning left onto the same road with a green arrow. Who has the right-of-way? → The vehicle with the green left turn a,DL-7: Right-of-Way Rules,TX DPS DL-7 handbook / TX Transportation Code,PASS,,
TX-SAF-0001,SAFE_DRIVING,What is the most important defensive driving technique? → Maintaining a space cushion around your vehicle,DL-7: Safe Driving Practices,TX DPS DL-7 handbook / TX Transportation Code,PASS,,
TX-SAF-0002,SAFE_DRIVING,How often should you check your mirrors while driving? → Every 5-8 seconds,DL-7: Safe Driving Practices,TX DPS DL-7 handbook / TX Transportation Code,PASS,,
TX-SAF-0003,SAFE_DRIVING,What is the minimum recommended following distance in good conditions? → 3 seconds,DL-7: Safe Driving Practices,TX DPS DL-7 handbook / TX Transportation Code,PASS,,
TX-SAF-0004,SAFE_DRIVING,How far ahead should you scan the road while driving on a highway? → 12-15 seconds ahead,DL-7: Safe Driving Practices,TX DPS DL-7 handbook / TX Transportation Code,PASS,,
TX-SAF-0005,SAFE_DRIVING,"When should you check your blind spots? → Before changing lanes, turning, or backing up",DL-7: Safe Driving Practices,TX DPS DL-7 handbook / TX Transportation Code,PASS,,
TX-SAF-0006,SAFE_DRIVING,"What does 'aim high in steering' mean in defensive driving? → Look far down the road, not just at the vehicle ahead",DL-7: Safe Driving Practices,TX DPS DL-7 handbook / TX Transportation Code,PASS,,
TX-SAF-0007,SAFE_DRIVING,What should you do when encountering an aggressive driver? → Let them pass and maintain a safe distance,DL-7: Safe Driving Practices,TX DPS DL-7 handbook / TX Transportation Code,PASS,,
TX-SAF-0008,SAFE_DRIVING,What is the safest way to handle a cell phone call while driving? → Pull over safely before answering,DL-7: Safe Driving Practices,TX DPS DL-7 handbook / TX Transportation Code,PASS,,
TX-SAF-0009,SAFE_DRIVING,What does 'leave yourself an out' mean in defensive driving? → Always have an escape route if trouble develops,DL-7: Safe Driving Practices,TX DPS DL-7 handbook / TX Transportation Code,PASS,,
TX-SAF-0010,SAFE_DRIVING,"When should you increase your following distance beyond 3 seconds? → In rain, fog, or poor visibility conditions",DL-7: Safe Driving Practices,TX DPS DL-7 handbook / TX Transportation Code,PASS,,
TX-SAF-0011,SAFE_DRIVING,What is the main purpose of the 'Smith System' of defensive driving? → To organize driver behavior for early hazard recognition,DL-7: Safe Driving Practices,TX DPS DL-7 handbook / TX Transportation Code,PASS,,
TX-SAF-0012,SAFE_DRIVING,"What should you watch for to predict another driver's actions? → Brake lights, turn signals, and head movements",DL-7: Safe Driving Practices,TX DPS DL-7 handbook / TX Transportation Code,PASS,,
TX-SAF-0013,SAFE_DRIVING,"What does 'keep your eyes moving' mean in defensive driving? → Continuously scan mirrors, gauges, and ahead rather than fixating",DL-7: Safe Driving Practices,TX DPS DL-7 handbook / TX Transportation Code,PASS,,
TX-SAF-0014,SAFE_DRIVING,When should you yield even if you have the right-of-way? → When necessary to avoid a collision,DL-7: Safe Driving Practices,TX DPS DL-7 handbook / TX Transportation Code,PASS,,
TX-SAF-0015,SAFE_DRIVING,"How can you make sure other drivers see you? → Use signals, horn, and lights to communicate your presence",DL-7: Safe Driving Practices,TX DPS DL-7 handbook / TX Transportation Code,PASS,,
TX-SAF-0016,SAFE_DRIVING,What is the safest position when stopped behind another vehicle at a traffic light? → Far enough back to see the rear tires of the vehicle ahead,DL-7: Safe Driving Practices,TX DPS DL-7 handbook / TX Transportation Code,PASS,,
TX-SAF-0017,SAFE_DRIVING,What should you do if you realize you're about to miss your exit on a highway? → Continue to the next exit and turn around,DL-7: Safe Driving Practices,TX DPS DL-7 handbook / TX Transportation Code,PASS,,
TX-SAF-0018,SAFE_DRIVING,What is the best strategy for driving in heavy traffic? → Maintain steady speed and avoid unnecessary lane changes,DL-7: Safe Driving Practices,TX DPS DL-7 handbook / TX Transportation Code,PASS,,
TX-SAF-0019,SAFE_DRIVING,What is the primary cause of rear-end collisions? → Following too closely for conditions,DL-7: Safe Driving Practices,TX DPS DL-7 handbook / TX Transportation Code,PASS,,
TX-SAF-0020,SAFE_DRIVING,What should you do when you see a vehicle preparing to enter your lane? → Adjust speed or position to create space for them,DL-7: Safe Driving Practices,TX DPS DL-7 handbook / TX Transportation Code,PASS,,
TX-SAF-0021,SAFE_DRIVING,How should you position your hands to maintain best control while driving? → At 9 and 3 o'clock or 8 and 4 o'clock positions,DL-7: Safe Driving Practices,TX DPS DL-7 handbook / TX Transportation Code,PASS,,
TX-SAF-0022,SAFE_DRIVING,What is the best way to handle distractions inside your vehicle? → Address them before driving or pull over safely,DL-7: Safe Driving Practices,TX DPS DL-7 handbook / TX Transportation Code,PASS,,
TX-SAF-0023,SAFE_DRIVING,"When is it acceptable to drive in another vehicle's blind spot? → Never, always move ahead or drop back",DL-7: Safe Driving Practices,TX DPS DL-7 handbook / TX Transportation Code,PASS,,
TX-SAF-0024,SAFE_DRIVING,What should you do when approaching an intersection with a green light? → Check for vehicles running the red light before entering,DL-7: Safe Driving Practices,TX DPS DL-7 handbook / TX Transportation Code,PASS,,
TX-SAF-0025,SAFE_DRIVING,"What is the main benefit of smooth, gradual steering and braking? → Maintains vehicle stability and gives you more control",DL-7: Safe Driving Practices,TX DPS DL-7 handbook / TX Transportation Code,PASS,,
TX-SAF-0026,SAFE_DRIVING,What is the legal blood alcohol concentration (BAC) limit for drivers 21 and over in Texas? → 0.08%,DL-7: Safe Driving Practices,TX DPS DL-7 handbook / TX Transportation Code,PASS,,
TX-SAF-0027,SAFE_DRIVING,What is the BAC limit for drivers under 21 years old in Texas? → Any detectable amount,DL-7: Safe Driving Practices,TX DPS DL-7 handbook / TX Transportation Code,PASS,,
TX-SAF-0028,SAFE_DRIVING,When does alcohol impairment begin? → With the first drink,DL-7: Safe Driving Practices,TX DPS DL-7 handbook / TX Transportation Code,PASS,,
TX-SAF-0029,SAFE_DRIVING,What is the approximate rate at which the body eliminates alcohol? → One standard drink per hour,DL-7: Safe Driving Practices,TX DPS DL-7 handbook / TX Transportation Code,PASS,,
TX-SAF-0030,SAFE_DRIVING,"Which abilities are most affected by alcohol consumption? → Judgment, reaction time, and coordination",DL-7: Safe Driving Practices,TX DPS DL-7 handbook / TX Transportation Code,PASS,,
TX-SAF-0031,SAFE_DRIVING,"What is the safest choice if you've been drinking? → Use a designated driver, taxi, or rideshare service",DL-7: Safe Driving Practices,TX DPS DL-7 handbook / TX Transportation Code,PASS,,
TX-SAF-0032,SAFE_DRIVING,What is the BAC limit for commercial drivers in Texas? → 0.04%,DL-7: Safe Driving Practices,TX DPS DL-7 handbook / TX Transportation Code,PASS,,
TX-SAF-0033,SAFE_DRIVING,"Can prescription medications impair driving ability? → Yes, many prescriptions can cause drowsiness or impairment",DL-7: Safe Driving Practices,TX DPS DL-7 handbook / TX Transportation Code,PASS,,
TX-SAF-0034,SAFE_DRIVING,What happens when alcohol is combined with other drugs? → The combined effect is greater than either substance alone,DL-7: Safe Driving Practices,TX DPS DL-7 handbook / TX Transportation Code,PASS,,
TX-SAF-0035,SAFE_DRIVING,"What are warning signs of drowsy driving? → Yawning, heavy eyelids, drifting from lane, and missing exits",DL-7: Safe Driving Practices,TX DPS DL-7 handbook / TX Transportation Code,PASS,,
TX-SAF-0036,SAFE_DRIVING,How often should you take breaks on a long trip? → Every 2 hours or 100 miles,DL-7: Safe Driving Practices,TX DPS DL-7 handbook / TX Transportation Code,PASS,,
TX-SAF-0037,SAFE_DRIVING,What is the only cure for drowsiness while driving? → Sleep,DL-7: Safe Driving Practices,TX DPS DL-7 handbook / TX Transportation Code,PASS,,
TX-SAF-0038,SAFE_DRIVING,How long should a power nap be if you're drowsy while driving? → 15-20 minutes,DL-7: Safe Driving Practices,TX DPS DL-7 handbook / TX Transportation Code,PASS,,
TX-SAF-0039,SAFE_DRIVING,"Can over-the-counter medications impair driving? → Yes, many cause drowsiness or reduced alertness",DL-7: Safe Driving Practices,TX DPS DL-7 handbook / TX Transportation Code,PASS,,
TX-SAF-0040,SAFE_DRIVING,"Why is drowsy driving as dangerous as drunk driving? → It impairs reaction time, judgment, and can cause microsleeps",DL-7: Safe Driving Practices,TX DPS DL-7 handbook / TX Transportation Code,PASS,,
TX-SAF-0041,SAFE_DRIVING,What should you do if you start feeling drowsy while driving? → Find a safe place to pull over and rest or sleep,DL-7: Safe Driving Practices,TX DPS DL-7 handbook / TX Transportation Code,PASS,,
TX-SAF-0042,SAFE_DRIVING,Which illegal drugs can impair driving ability? → All illegal drugs can impair driving,DL-7: Safe Driving Practices,TX DPS DL-7 handbook / TX Transportation Code,PASS,,
TX-SAF-0043,SAFE_DRIVING,What should you check before taking any medication and driving? → Read labels and ask your doctor or pharmacist about driving effects,DL-7: Safe Driving Practices,TX DPS DL-7 handbook / TX Transportation Code,PASS,,
TX-SAF-0044,SAFE_DRIVING,What is the greatest danger of driving after drinking small amounts of alcohol? → Impaired judgment may lead to poor decisions,DL-7: Safe Driving Practices,TX DPS DL-7 handbook / TX Transportation Code,PASS,,
TX-SAF-0045,SAFE_DRIVING,"What time of day are you most at risk for drowsy driving? → Late night and early morning hours, especially 2-6 AM",DL-7: Safe Driving Practices,TX DPS DL-7 handbook / TX Transportation Code,PASS,,
TX-SAF-0046,SAFE_DRIVING,What should you do when it starts raining? → Reduce speed and increase following distance,DL-7: Safe Driving Practices,TX DPS DL-7 handbook / TX Transportation Code,PASS,,
TX-SAF-0047,SAFE_DRIVING,Why are roads most slippery during the first few minutes of rain? → Rain mixes with oil and dust to create a slick film,DL-7: Safe Driving Practices,TX DPS DL-7 handbook / TX Transportation Code,PASS,,
TX-SAF-0048,SAFE_DRIVING,How much should you increase your following distance in rain? → Double it to at least 6 seconds,DL-7: Safe Driving Practices,TX DPS DL-7 handbook / TX Transportation Code,PASS,,
TX-SAF-0049,SAFE_DRIVING,What is hydroplaning? → When tires lose contact with the road due to water,DL-7: Safe Driving Practices,TX DPS DL-7 handbook / TX Transportation Code,PASS,,
TX-SAF-0050,SAFE_DRIVING,What should you do if your vehicle starts hydroplaning? → Ease off the gas and steer straight until you regain traction,DL-7: Safe Driving Practices,TX DPS DL-7 handbook / TX Transportation Code,PASS,,
TX-SAF-0051,SAFE_DRIVING,What type of headlights should you use in fog? → Low beams,DL-7: Safe Driving Practices,TX DPS DL-7 handbook / TX Transportation Code,PASS,,
TX-SAF-0052,SAFE_DRIVING,"What should you do when driving in fog? → Slow down, use low beams, and increase following distance",DL-7: Safe Driving Practices,TX DPS DL-7 handbook / TX Transportation Code,PASS,,
TX-SAF-0053,SAFE_DRIVING,How should you adjust your speed on icy roads? → Reduce speed drastically and increase following distance to 9+ seconds,DL-7: Safe Driving Practices,TX DPS DL-7 handbook / TX Transportation Code,PASS,,
TX-SAF-0054,SAFE_DRIVING,"What is the best technique for driving on ice or snow? → Use gentle, smooth steering and braking inputs",DL-7: Safe Driving Practices,TX DPS DL-7 handbook / TX Transportation Code,PASS,,
TX-SAF-0055,SAFE_DRIVING,When must you use headlights in Texas? → From 30 minutes after sunset to 30 minutes before sunrise,DL-7: Safe Driving Practices,TX DPS DL-7 handbook / TX Transportation Code,PASS,,
TX-SAF-0056,SAFE_DRIVING,"When should you use high beams, and when should you dim them? → Use high beams in rural areas, dim within 500 feet of oncoming traffic",DL-7: Safe Driving Practices,"TX Transportation Code §547.333 — 500ft oncoming, 300ft following",REVIEW,P2,Answer is correct for oncoming traffic but incomplete. Add that you must also dim within 300 feet when following another vehicle (§547.333).
TX-SAF-0057,SAFE_DRIVING,Why should you reduce speed when driving at night? → Your headlights don't illuminate as far as you can see during the day,DL-7: Safe Driving Practices,TX DPS DL-7 handbook / TX Transportation Code,PASS,,
TX-SAF-0058,SAFE_DRIVING,"What additional hazards should you watch for at night? → Pedestrians, cyclists, and animals that are harder to see",DL-7: Safe Driving Practices,TX DPS DL-7 handbook / TX Transportation Code,PASS,,
TX-SAF-0059,SAFE_DRIVING,"What should you do when experiencing sun glare? → Use sun visor, wear sunglasses, and slow down",DL-7: Safe Driving Practices,TX DPS DL-7 handbook / TX Transportation Code,PASS,,
TX-SAF-0060,SAFE_DRIVING,"What factors contribute to hydroplaning? → Speed, tire tread depth, and water depth on the road",DL-7: Safe Driving Practices,TX DPS DL-7 handbook / TX Transportation Code,PASS,,
TX-SAF-0061,SAFE_DRIVING,When should you use headlights during rain in Texas? → Anytime you need windshield wipers,DL-7: Safe Driving Practices,TX Transportation Code §547.302,FAIL,P0,"Change answer to: 'When visibility is reduced to less than 1,000 feet'. Texas does NOT tie headlight use to wiper use. §547.302 requires headlights when atmospheric conditions reduce visibility below 1,000 feet."
TX-SAF-0062,SAFE_DRIVING,Why is black ice particularly dangerous? → It's nearly invisible on the road surface,DL-7: Safe Driving Practices,TX DPS DL-7 handbook / TX Transportation Code,PASS,,
TX-SAF-0063,SAFE_DRIVING,What should you avoid during rain to prevent hydroplaning? → Sudden braking or steering and high speeds,DL-7: Safe Driving Practices,TX DPS DL-7 handbook / TX Transportation Code,PASS,,
TX-SAF-0064,SAFE_DRIVING,"Where is ice most likely to form on roads? → On bridges, overpasses, and shaded areas",DL-7: Safe Driving Practices,TX DPS DL-7 handbook / TX Transportation Code,PASS,,
TX-SAF-0065,SAFE_DRIVING,What is the main purpose of windshield wipers? → To maintain clear visibility through the windshield,DL-7: Safe Driving Practices,TX DPS DL-7 handbook / TX Transportation Code,PASS,,
TX-SAF-0066,SAFE_DRIVING,What is the minimum tire tread depth required in Texas? → 2/32 of an inch,DL-7: Safe Driving Practices,TX DPS DL-7 handbook / TX Transportation Code,PASS,,
TX-SAF-0067,SAFE_DRIVING,"How can you check tire tread depth using a penny? → Insert penny with Lincoln's head down; if you see his full head, tires are worn",DL-7: Safe Driving Practices,TX DPS DL-7 handbook / TX Transportation Code,PASS,,
TX-SAF-0068,SAFE_DRIVING,How often should you check tire pressure? → At least once a month,DL-7: Safe Driving Practices,TX DPS DL-7 handbook / TX Transportation Code,PASS,,
TX-SAF-0069,SAFE_DRIVING,"What are signs that your brakes need service? → Grinding noise, pulling to one side, or soft brake pedal",DL-7: Safe Driving Practices,TX DPS DL-7 handbook / TX Transportation Code,PASS,,
TX-SAF-0070,SAFE_DRIVING,Why is it important to keep all vehicle lights working? → They help you see and help others see you,DL-7: Safe Driving Practices,TX DPS DL-7 handbook / TX Transportation Code,PASS,,
