question_id,topic,claim_summary,reference_in_question,authoritative_source,status,risk_level,proposed_fix
TX-SIG-0110,SIGNS,A 'TRUCKS USE RIGHT LANE' sign means: → Commercial trucks should stay in the right lane,DL-7: Traffic Signs,TX DPS DL-7 handbook / TX Transportation Code,PASS,,
TX-SIG-0111,SIGNS,What does a 'SOFT SHOULDER' sign indicate? → The road edge is unpaved and may not support vehicle weight,DL-7: Traffic Signs,TX DPS DL-7 handbook / TX Transportation Code,PASS,,
TX-SIG-0112,SIGNS,A sign reading 'SLOWER TRAFFIC KEEP RIGHT' is: → A suggestion for courtesy but not legally enforceable,DL-7: Traffic Signs,"TX Transportation Code §545.051 — legally enforceable, fines up to $200",FAIL,P1,Change answer to reflect that §545.051 makes this a legal requirement in Texas. Slower drivers must use right lane. Fines up to $200 for violations.
TX-SIG-0113,SIGNS,What does a 'DIP' warning sign indicate? → A low place in the road where water may collect,DL-7: Traffic Signs,TX DPS DL-7 handbook / TX Transportation Code,PASS,,
TX-SIG-0114,SIGNS,A 'BUMP' warning sign means: → A raised area in the pavement ahead,DL-7: Traffic Signs,TX DPS DL-7 handbook / TX Transportation Code,PASS,,
TX-SIG-0115,SIGNS,What does a 'DIVIDED HIGHWAY BEGINS' sign indicate? → The road ahead will have a median separating opposing traffic,DL-7: Traffic Signs,TX DPS DL-7 handbook / TX Transportation Code,PASS,,
TX-SIG-0116,SIGNS,A 'DIVIDED HIGHWAY ENDS' sign warns that: → Two-way traffic with no median is ahead,DL-7: Traffic Signs,TX DPS DL-7 handbook / TX Transportation Code,PASS,,
TX-SIG-0117,SIGNS,What does 'PAVEMENT ENDS' mean? → Paved road surface changes to gravel or dirt ahead,DL-7: Traffic Signs,TX DPS DL-7 handbook / TX Transportation Code,PASS,,
TX-SIG-0118,SIGNS,A regulatory sign with a white arrow on blue background indicates: → Direction of required travel or movement,DL-7: Traffic Signs,TX DPS DL-7 handbook / TX Transportation Code,PASS,,
TX-SIG-0119,SIGNS,What does 'SIGNAL AHEAD' warn you about? → A traffic light is coming up,DL-7: Traffic Signs,TX DPS DL-7 handbook / TX Transportation Code,PASS,,
TX-SIG-0120,SIGNS,A 'STOP AHEAD' warning sign is used when: → A stop sign is not visible until you are very close to it,DL-7: Traffic Signs,TX DPS DL-7 handbook / TX Transportation Code,PASS,,
TX-SPC-0001,SPECIAL_SITUATIONS,"When a school bus stops with flashing red lights and an extended stop sign on an undivided roadway, vehicles in both directions must: → Stop and remain stopped until the lights stop flashing",DL-7: Special Driving Situations,TX DPS DL-7 handbook / TX Transportation Code,PASS,,
TX-SPC-0002,SPECIAL_SITUATIONS,You are traveling on a divided highway with a raised concrete median barrier. A school bus on the opposite side stops with red lights flashing. What should you do? → Continue driving at normal speed s,DL-7: Special Driving Situations,TX DPS DL-7 handbook / TX Transportation Code,PASS,,
TX-SPC-0003,SPECIAL_SITUATIONS,What is the minimum distance you must stop from a school bus with flashing red lights? → 20 feet,DL-7: Special Driving Situations,TX DPS DL-7 handbook / TX Transportation Code,PASS,,
TX-SPC-0004,SPECIAL_SITUATIONS,"When driving through an active school zone with flashing signals, the speed limit is typically: → 15 to 20 mph when children are present",DL-7: Special Driving Situations,TX DPS DL-7 handbook / TX Transportation Code,PASS,,
TX-SPC-0005,SPECIAL_SITUATIONS,A school bus ahead of you is slowing down with amber (yellow) warning lights flashing. What does this indicate? → The bus is preparing to stop to load or unload children,DL-7: Special Driving Situations,TX DPS DL-7 handbook / TX Transportation Code,PASS,,
TX-SPC-0006,SPECIAL_SITUATIONS,"What is the penalty range for illegally passing a stopped school bus with flashing red lights in Texas? → $500 to $1,250 fine",DL-7: Special Driving Situations,TX DPS DL-7 handbook / TX Transportation Code,PASS,,
TX-SPC-0007,SPECIAL_SITUATIONS,"When are school zone speed limits typically in effect? → When posted signs or flashing lights indicate, usually 30 minutes before and after school",DL-7: Special Driving Situations,TX DPS DL-7 handbook / TX Transportation Code,PASS,,
TX-SPC-0008,SPECIAL_SITUATIONS,"Can you pass a school bus from either direction when its red lights are flashing? → No, passing is prohibited from both directions on undivided roads",DL-7: Special Driving Situations,TX DPS DL-7 handbook / TX Transportation Code,PASS,,
TX-SPC-0009,SPECIAL_SITUATIONS,"You are on a four-lane road with a painted center turn lane. A school bus on the opposite side stops with red lights flashing. What must you do? → Stop, because a painted median does not divide the ro",DL-7: Special Driving Situations,TX DPS DL-7 handbook / TX Transportation Code,PASS,,
TX-SPC-0010,SPECIAL_SITUATIONS,"When a school bus stop sign is extended and red lights are flashing, when can you proceed? → When the lights stop flashing and the stop sign is retracted",DL-7: Special Driving Situations,TX DPS DL-7 handbook / TX Transportation Code,PASS,,
TX-SPC-0011,SPECIAL_SITUATIONS,"While driving in a school zone, you see a crossing guard holding up a stop sign. What should you do? → Stop immediately and remain stopped until the guard signals it is safe to proceed",DL-7: Special Driving Situations,TX DPS DL-7 handbook / TX Transportation Code,PASS,,
TX-SPC-0012,SPECIAL_SITUATIONS,What does a pentagon-shaped yellow sign with black symbols indicate? → A school zone or school crossing ahead,DL-7: Special Driving Situations,TX DPS DL-7 handbook / TX Transportation Code,PASS,,
TX-SPC-0013,SPECIAL_SITUATIONS,"A school bus is stopped ahead with alternating flashing red lights but the stop sign is not yet extended. What should you do? → Stop immediately, as flashing red lights require you to stop",DL-7: Special Driving Situations,TX DPS DL-7 handbook / TX Transportation Code,PASS,,
TX-SPC-0014,SPECIAL_SITUATIONS,"In a school zone, you should be especially alert for: → Children who may suddenly enter the roadway",DL-7: Special Driving Situations,TX DPS DL-7 handbook / TX Transportation Code,PASS,,
TX-SPC-0015,SPECIAL_SITUATIONS,You are on a highway with five lanes: two in each direction and a center turn lane. A school bus stops on the opposite side with red lights flashing. What is required? → You must stop because the cent,DL-7: Special Driving Situations,TX DPS DL-7 handbook / TX Transportation Code,PASS,,
TX-SPC-0016,SPECIAL_SITUATIONS,How far from the nearest railroad track must you stop when a train is approaching? → 15 to 50 feet,DL-7: Special Driving Situations,TX DPS DL-7 handbook / TX Transportation Code,PASS,,
TX-SPC-0017,SPECIAL_SITUATIONS,"You must stop at a railroad crossing when: → Lights are flashing, gates are lowering, or a train is visible or audible",DL-7: Special Driving Situations,TX DPS DL-7 handbook / TX Transportation Code,PASS,,
TX-SPC-0018,SPECIAL_SITUATIONS,"While crossing railroad tracks, your vehicle becomes stalled on the tracks. What is the first thing you should do? → Get everyone out of the vehicle immediately and move away from the tracks",DL-7: Special Driving Situations,TX DPS DL-7 handbook / TX Transportation Code,PASS,,
TX-SPC-0019,SPECIAL_SITUATIONS,"When crossing railroad tracks, you should: → Not shift gears while on the tracks",DL-7: Special Driving Situations,TX DPS DL-7 handbook / TX Transportation Code,PASS,,
TX-SPC-0020,SPECIAL_SITUATIONS,A round yellow sign with a black X and two R's means: → Railroad crossing ahead,DL-7: Special Driving Situations,TX DPS DL-7 handbook / TX Transportation Code,PASS,,
TX-SPC-0021,SPECIAL_SITUATIONS,"After one train passes at a railroad crossing with multiple tracks, you should: → Check for a second train on other tracks before crossing",DL-7: Special Driving Situations,TX DPS DL-7 handbook / TX Transportation Code,PASS,,
TX-SPC-0022,SPECIAL_SITUATIONS,"Is it legal to drive around lowered railroad crossing gates? → No, it is illegal and extremely dangerous",DL-7: Special Driving Situations,TX DPS DL-7 handbook / TX Transportation Code,PASS,,
TX-SPC-0023,SPECIAL_SITUATIONS,"Before crossing railroad tracks, you should make sure: → You can completely clear all tracks without stopping",DL-7: Special Driving Situations,TX DPS DL-7 handbook / TX Transportation Code,PASS,,
TX-SPC-0024,SPECIAL_SITUATIONS,"After your vehicle is stalled on railroad tracks and everyone has evacuated, what should you do next? → Call 911 and provide the crossing number posted on the signal equipment",DL-7: Special Driving Situations,TX DPS DL-7 handbook / TX Transportation Code,PASS,,
TX-SPC-0025,SPECIAL_SITUATIONS,Flashing red lights at a railroad crossing mean: → Stop and do not proceed until the lights stop flashing,DL-7: Special Driving Situations,TX DPS DL-7 handbook / TX Transportation Code,PASS,,
TX-SPC-0026,SPECIAL_SITUATIONS,What is the minimum distance you must park from railroad tracks? → 100 feet,DL-7: Special Driving Situations,TX Transportation Code §545.302(c)(1) — actually 50 feet,FAIL,P0,"Change answer from '100 feet' to '50 feet'. §545.302 prohibits parking within 50 feet of nearest rail. Note: TX-PRK-0008 correctly states 50 feet, creating an internal contradiction."
TX-SPC-0027,SPECIAL_SITUATIONS,You see a pavement marking with a large X and two R's at an intersection. This indicates: → Railroad tracks cross the road ahead,DL-7: Special Driving Situations,TX DPS DL-7 handbook / TX Transportation Code,PASS,,
TX-SPC-0028,SPECIAL_SITUATIONS,"When approaching railroad tracks, you should always: → Look both directions before crossing, even if no warning signals are present",DL-7: Special Driving Situations,TX DPS DL-7 handbook / TX Transportation Code,PASS,,
TX-SPC-0029,SPECIAL_SITUATIONS,"If you cannot get your vehicle off railroad tracks and you can see or hear a train approaching, you should move away from the tracks: → In the direction the train is coming from, at an angle away from",DL-7: Special Driving Situations,TX DPS DL-7 handbook / TX Transportation Code,PASS,,
TX-SPC-0030,SPECIAL_SITUATIONS,"At a railroad crossing without gates or flashing lights, you must: → Slow down, look both ways, and be prepared to stop",DL-7: Special Driving Situations,TX DPS DL-7 handbook / TX Transportation Code,PASS,,
TX-SPC-0031,SPECIAL_SITUATIONS,What does an orange diamond-shaped sign indicate? → Work zone or construction area ahead,DL-7: Special Driving Situations,TX DPS DL-7 handbook / TX Transportation Code,PASS,,
TX-SPC-0032,SPECIAL_SITUATIONS,"In active work zones in Texas, traffic fines are: → Doubled",DL-7: Special Driving Situations,TX DPS DL-7 handbook / TX Transportation Code,PASS,,
TX-SPC-0033,SPECIAL_SITUATIONS,"When you see a flagger holding a STOP paddle, you must: → Stop immediately and remain stopped until the flagger signals you to proceed",DL-7: Special Driving Situations,TX DPS DL-7 handbook / TX Transportation Code,PASS,,
TX-SPC-0034,SPECIAL_SITUATIONS,"Under Texas Move Over Law, when you see a stopped emergency vehicle with flashing lights on the roadside, you must: → Change lanes away from the vehicle, or slow to 20 mph below the limit if you canno",DL-7: Special Driving Situations,TX DPS DL-7 handbook / TX Transportation Code,PASS,,
TX-SPC-0035,SPECIAL_SITUATIONS,A flagger displays a SLOW paddle. What should you do? → Reduce your speed and proceed with caution,DL-7: Special Driving Situations,TX DPS DL-7 handbook / TX Transportation Code,PASS,,
TX-SPC-0036,SPECIAL_SITUATIONS,"If the posted speed limit is 25 mph or less and you cannot change lanes away from a stopped emergency vehicle, how much must you slow down? → To 5 mph",DL-7: Special Driving Situations,TX DPS DL-7 handbook / TX Transportation Code,PASS,,
TX-SPC-0037,SPECIAL_SITUATIONS,"In work zones, you should: → Watch for workers and equipment entering the roadway",DL-7: Special Driving Situations,TX DPS DL-7 handbook / TX Transportation Code,PASS,,
TX-SPC-0038,SPECIAL_SITUATIONS,"What is the maximum fine for violating the Texas Move Over Law? → $2,000",DL-7: Special Driving Situations,TX DPS DL-7 handbook / TX Transportation Code,PASS,,
TX-SPC-0039,SPECIAL_SITUATIONS,"Which vehicles are covered under the Texas Move Over Law? → Police, fire, EMS, tow trucks, and TxDOT vehicles with flashing lights",DL-7: Special Driving Situations,TX DPS DL-7 handbook / TX Transportation Code,PASS,,
TX-SPC-0040,SPECIAL_SITUATIONS,"When approaching a work zone where lanes are merging, you should: → Merge early and avoid unnecessary lane changes",DL-7: Special Driving Situations,TX DPS DL-7 handbook / TX Transportation Code,PASS,,
TX-SPC-0041,SPECIAL_SITUATIONS,A flagger extends their arm horizontally. This signal means: → Stop,DL-7: Special Driving Situations,TX DPS DL-7 handbook / TX Transportation Code,PASS,,
TX-SPC-0042,SPECIAL_SITUATIONS,An orange warning sign with a symbol of a person holding a flag indicates: → Flagger ahead in work zone,DL-7: Special Driving Situations,TX DPS DL-7 handbook / TX Transportation Code,PASS,,
TX-SPC-0043,SPECIAL_SITUATIONS,"When a flagger waves a flag in a vertical up-and-down motion, you should: → Slow down",DL-7: Special Driving Situations,TX DPS DL-7 handbook / TX Transportation Code,PASS,,
TX-SPC-0044,SPECIAL_SITUATIONS,"In work zones, you should NOT: → Change lanes unnecessarily",DL-7: Special Driving Situations,TX DPS DL-7 handbook / TX Transportation Code,PASS,,
TX-SPC-0045,SPECIAL_SITUATIONS,You must treat a flagger's signals the same as: → Official traffic control signals,DL-7: Special Driving Situations,TX DPS DL-7 handbook / TX Transportation Code,PASS,,
TX-SPC-0046,SPECIAL_SITUATIONS,"If your vehicle breaks down on the highway, you should: → Pull over to the right shoulder, turn on hazard lights, and raise your hood",DL-7: Special Driving Situations,TX DPS DL-7 handbook / TX Transportation Code,PASS,,
TX-SPC-0047,SPECIAL_SITUATIONS,"If you experience a tire blowout while driving, you should: → Grip the wheel firmly, avoid sudden braking, and let the vehicle slow naturally",DL-7: Special Driving Situations,TX DPS DL-7 handbook / TX Transportation Code,PASS,,
TX-SPC-0048,SPECIAL_SITUATIONS,"If your brakes fail while driving, you should first: → Pump the brake pedal rapidly several times",DL-7: Special Driving Situations,TX DPS DL-7 handbook / TX Transportation Code,PASS,,
TX-SPC-0049,SPECIAL_SITUATIONS,"If your vehicle catches fire, you should: → Pull over immediately, get everyone out, move far away, and call 911",DL-7: Special Driving Situations,TX DPS DL-7 handbook / TX Transportation Code,PASS,,
TX-SPC-0050,SPECIAL_SITUATIONS,"If you are involved in a crash, you must: → Stop immediately at the scene or nearby",DL-7: Special Driving Situations,TX DPS DL-7 handbook / TX Transportation Code,PASS,,
TX-SPC-0051,SPECIAL_SITUATIONS,"After a crash, you must report it to police if: → There are injuries or property damage exceeding $1,000",DL-7: Special Driving Situations,TX DPS DL-7 handbook / TX Transportation Code,PASS,,
TX-SPC-0052,SPECIAL_SITUATIONS,"If your vehicle is broken down on a busy highway, you should generally: → Stay in your vehicle with doors locked until help arrives",DL-7: Special Driving Situations,TX DPS DL-7 handbook / TX Transportation Code,PASS,,
TX-SPC-0053,SPECIAL_SITUATIONS,"If you must exit your disabled vehicle on a highway, you should: → Exit through the passenger side door away from traffic",DL-7: Special Driving Situations,TX DPS DL-7 handbook / TX Transportation Code,PASS,,
TX-SPC-0054,SPECIAL_SITUATIONS,"After a crash, you should exchange which information with the other driver? → Name, address, phone number, insurance information, and driver license number",DL-7: Special Driving Situations,TX DPS DL-7 handbook / TX Transportation Code,PASS,,
TX-SPC-0055,SPECIAL_SITUATIONS,"If you encounter a hazardous materials spill on the roadway, you should: → Stay upwind and uphill from the spill, do not touch it, and call 911",DL-7: Special Driving Situations,TX DPS DL-7 handbook / TX Transportation Code,PASS,,
TX-SPC-0056,SPECIAL_SITUATIONS,"After a crash with no injuries, should you move the vehicles if they are blocking traffic? → Yes, if it is safe to do so, move vehicles to the shoulder",DL-7: Special Driving Situations,TX DPS DL-7 handbook / TX Transportation Code,PASS,,
TX-SPC-0057,SPECIAL_SITUATIONS,"If your brakes fail and pumping does not restore pressure, you should next: → Downshift to a lower gear to use engine braking",DL-7: Special Driving Situations,TX DPS DL-7 handbook / TX Transportation Code,PASS,,
TX-SPC-0058,SPECIAL_SITUATIONS,"If you are involved in a crash, you should NOT: → Admit fault or apologize at the scene",DL-7: Special Driving Situations,TX DPS DL-7 handbook / TX Transportation Code,PASS,,
TX-SPC-0059,SPECIAL_SITUATIONS,"If you have warning triangles or flares after a breakdown, you should place them: → Behind your vehicle at increasing distances to warn approaching traffic",DL-7: Special Driving Situations,TX DPS DL-7 handbook / TX Transportation Code,PASS,,
TX-SPC-0060,SPECIAL_SITUATIONS,"If you are the first to arrive at a crash scene with injured people, your first priority should be to: → Call 911 and keep injured people still unless they are in immediate danger",DL-7: Special Driving Situations,TX DPS DL-7 handbook / TX Transportation Code,PASS,,
TX-SPD-0001,SPEED_AND_DISTANCE,What is the typical speed limit in a school zone when children are present? → 15-20 mph,DL-7: Speed Limits and Safe Distances,TX DPS DL-7 handbook / TX Transportation Code,PASS,,
TX-SPD-0002,SPEED_AND_DISTANCE,What is the typical speed limit in a residential area unless otherwise posted? → 30 mph,DL-7: Speed Limits and Safe Distances,TX DPS DL-7 handbook / TX Transportation Code,PASS,,
TX-SPD-0003,SPEED_AND_DISTANCE,What is the maximum speed limit on rural Texas highways? → 70-75 mph depending on the road,DL-7: Speed Limits and Safe Distances,TX Transportation Code §545.353 — allows up to 85 mph,REVIEW,P1,"Update answer to include that Texas allows speed limits up to 85 mph on certain highways (e.g., SH 130 toll road). The 70-75 range is common but not the maximum."
TX-SPD-0004,SPEED_AND_DISTANCE,The basic speed law requires you to: → Never drive faster than is safe for current conditions,DL-7: Speed Limits and Safe Distances,TX DPS DL-7 handbook / TX Transportation Code,PASS,,
TX-SPD-0005,SPEED_AND_DISTANCE,"When should you reduce your speed below the posted limit? → In poor weather, heavy traffic, or reduced visibility",DL-7: Speed Limits and Safe Distances,TX DPS DL-7 handbook / TX Transportation Code,PASS,,
TX-SPD-0006,SPEED_AND_DISTANCE,What is a prima facie speed limit? → A speed limit that applies based on road type even when not posted,DL-7: Speed Limits and Safe Distances,TX DPS DL-7 handbook / TX Transportation Code,PASS,,
TX-SPD-0007,SPEED_AND_DISTANCE,What is the typical speed limit on urban highways in Texas? → 60 mph,DL-7: Speed Limits and Safe Distances,TX DPS DL-7 handbook / TX Transportation Code,PASS,,
TX-SPD-0008,SPEED_AND_DISTANCE,What does driving too slowly on a highway violate? → Minimum speed laws that prohibit impeding traffic flow,DL-7: Speed Limits and Safe Distances,TX DPS DL-7 handbook / TX Transportation Code,PASS,,
TX-SPD-0009,SPEED_AND_DISTANCE,When are school zone speed limits typically enforced? → When children are present or signals are flashing,DL-7: Speed Limits and Safe Distances,TX DPS DL-7 handbook / TX Transportation Code,PASS,,
TX-SPD-0010,SPEED_AND_DISTANCE,What should you do when driving through a construction zone? → Reduce speed and obey posted construction zone speed limits,DL-7: Speed Limits and Safe Distances,TX DPS DL-7 handbook / TX Transportation Code,PASS,,
TX-SPD-0011,SPEED_AND_DISTANCE,"On a highway with a posted speed limit of 65 mph, what is generally considered impeding traffic? → Driving significantly below the posted limit without justification",DL-7: Speed Limits and Safe Distances,TX DPS DL-7 handbook / TX Transportation Code,PASS,,
TX-SPD-0012,SPEED_AND_DISTANCE,Which factor most affects whether a speed is legally considered 'reasonable and prudent'? → Current road and traffic conditions,DL-7: Speed Limits and Safe Distances,TX DPS DL-7 handbook / TX Transportation Code,PASS,,
TX-SPD-0013,SPEED_AND_DISTANCE,What is the purpose of reduced speed limits in school zones? → To give drivers more time to react to children,DL-7: Speed Limits and Safe Distances,TX DPS DL-7 handbook / TX Transportation Code,PASS,,
TX-SPD-0014,SPEED_AND_DISTANCE,What speed limit typically applies in alleys in Texas? → 15 mph,DL-7: Speed Limits and Safe Distances,TX DPS DL-7 handbook / TX Transportation Code,PASS,,
TX-SPD-0015,SPEED_AND_DISTANCE,"When can you legally exceed the posted speed limit? → Never, posted limits are legal maximums under ideal conditions",DL-7: Speed Limits and Safe Distances,TX DPS DL-7 handbook / TX Transportation Code,PASS,,
TX-SPD-0016,SPEED_AND_DISTANCE,"A highway has a 70 mph speed limit but heavy fog reduces visibility to 100 feet. What is the legal maximum speed? → Whatever speed is safe for the conditions, likely well below 70 mph",DL-7: Speed Limits and Safe Distances,TX DPS DL-7 handbook / TX Transportation Code,PASS,,
TX-SPD-0017,SPEED_AND_DISTANCE,What is the typical speed limit on numbered highways in rural areas? → 70 mph for most highways,DL-7: Speed Limits and Safe Distances,TX DPS DL-7 handbook / TX Transportation Code,PASS,,
TX-SPD-0018,SPEED_AND_DISTANCE,"How should you adjust your speed when approaching a curve? → Slow down before entering the curve, not while in it",DL-7: Speed Limits and Safe Distances,TX DPS DL-7 handbook / TX Transportation Code,PASS,,
TX-SPD-0019,SPEED_AND_DISTANCE,Why is driving significantly slower than traffic flow dangerous even if you're at the speed limit? → It creates speed differentials that cause accidents,DL-7: Speed Limits and Safe Distances,TX DPS DL-7 handbook / TX Transportation Code,PASS,,
TX-SPD-0020,SPEED_AND_DISTANCE,What is the main reason speed limits are lower at night in some areas? → Reduced visibility limits reaction time and sight distance,DL-7: Speed Limits and Safe Distances,TX DPS DL-7 handbook / TX Transportation Code,PASS,,
TX-SPD-0021,SPEED_AND_DISTANCE,"What is the speed limit for a narrow, winding country road if no signs are posted? → Whatever speed is safe for the road conditions",DL-7: Speed Limits and Safe Distances,TX DPS DL-7 handbook / TX Transportation Code,PASS,,
TX-SPD-0022,SPEED_AND_DISTANCE,Where are you most likely to find a 20 mph speed limit? → School zones,DL-7: Speed Limits and Safe Distances,TX DPS DL-7 handbook / TX Transportation Code,PASS,,
TX-SPD-0023,SPEED_AND_DISTANCE,When is it legal to drive below the minimum speed limit on a highway? → When safety requires it due to weather or vehicle problems,DL-7: Speed Limits and Safe Distances,TX DPS DL-7 handbook / TX Transportation Code,PASS,,
TX-SPD-0024,SPEED_AND_DISTANCE,What is the general speed limit in business or urban districts unless posted otherwise? → 30 mph,DL-7: Speed Limits and Safe Distances,TX DPS DL-7 handbook / TX Transportation Code,PASS,,
TX-SPD-0025,SPEED_AND_DISTANCE,How does speed affect your field of vision? → Higher speeds narrow your field of vision to straight ahead,DL-7: Speed Limits and Safe Distances,TX DPS DL-7 handbook / TX Transportation Code,PASS,,
TX-SPD-0026,SPEED_AND_DISTANCE,"What should you do if other vehicles are exceeding the speed limit? → Drive at a safe, legal speed; don't follow unsafe behavior",DL-7: Speed Limits and Safe Distances,TX DPS DL-7 handbook / TX Transportation Code,PASS,,
TX-SPD-0027,SPEED_AND_DISTANCE,Why is speeding particularly dangerous on wet roads even at moderate speeds? → Stopping distance increases dramatically and hydroplaning risk rises,DL-7: Speed Limits and Safe Distances,TX DPS DL-7 handbook / TX Transportation Code,PASS,,
TX-SPD-0028,SPEED_AND_DISTANCE,"When entering a highway from an entrance ramp, you should: → Accelerate to match highway traffic speed before merging",DL-7: Speed Limits and Safe Distances,TX DPS DL-7 handbook / TX Transportation Code,PASS,,
TX-SPD-0029,SPEED_AND_DISTANCE,What is the relationship between speed and crash severity? → Higher speeds exponentially increase injury severity and fatality risk,DL-7: Speed Limits and Safe Distances,TX DPS DL-7 handbook / TX Transportation Code,PASS,,
TX-SPD-0030,SPEED_AND_DISTANCE,Which of these is a legal speed limit sign? → A white rectangular sign with black numbers and 'SPEED LIMIT' text,DL-7: Speed Limits and Safe Distances,TX DPS DL-7 handbook / TX Transportation Code,PASS,,
TX-SPD-0031,SPEED_AND_DISTANCE,"Under ideal conditions, what is the minimum safe following distance? → At least 3 seconds behind the vehicle ahead",DL-7: Speed Limits and Safe Distances,TX DPS DL-7 handbook / TX Transportation Code,PASS,,
TX-SPD-0032,SPEED_AND_DISTANCE,"How do you measure the 3-second following distance? → Pick a fixed object, count seconds from when the front vehicle passes until you pass it",DL-7: Speed Limits and Safe Distances,TX DPS DL-7 handbook / TX Transportation Code,PASS,,
TX-SPD-0033,SPEED_AND_DISTANCE,"When following a large truck or bus, you should maintain: → At least 4 seconds following distance",DL-7: Speed Limits and Safe Distances,TX DPS DL-7 handbook / TX Transportation Code,PASS,,
TX-SPD-0034,SPEED_AND_DISTANCE,How should you adjust following distance in rain? → Double your following distance to at least 6 seconds,DL-7: Speed Limits and Safe Distances,TX DPS DL-7 handbook / TX Transportation Code,PASS,,
